{
  "$schema": "http://json-schema.org/draft-07/schema#",
  "title": "SDP Intent Specification",
  "description": "Machine-readable feature intent specification for AI-human communication",
  "type": "object",
  "required": ["problem", "users", "success_criteria"],
  "properties": {
    "problem": {
      "type": "string",
      "minLength": 50,
      "description": "What problem does this feature solve? Be specific."
    },
    "users": {
      "type": "array",
      "minItems": 1,
      "maxItems": 10,
      "items": {
        "type": "string",
        "enum": ["end_users", "admins", "developers", "api_consumers", "operators"]
      },
      "description": "Who are the primary users of this feature?"
    },
    "success_criteria": {
      "type": "array",
      "minItems": 1,
      "items": {
        "type": "object",
        "required": ["criterion", "measurement"],
        "properties": {
          "criterion": {"type": "string", "minLength": 10},
          "measurement": {"type": "string", "minLength": 5}
        }
      },
      "description": "How do we measure success?"
    },
    "tradeoffs": {
      "type": "object",
      "properties": {
        "security": {"enum": ["prioritize", "accept", "reject"]},
        "performance": {"enum": ["prioritize", "accept", "reject"]},
        "complexity": {"enum": ["prioritize", "accept", "reject"]},
        "time_to_market": {"enum": ["prioritize", "accept", "reject"]}
      }
    },
    "technical_approach": {
      "type": "object",
      "properties": {
        "architecture": {
          "type": "string",
          "enum": ["monolith", "microservices", "serverless", "event_driven"]
        },
        "storage": {
          "type": "string",
          "enum": ["relational_db", "nosql", "in_memory", "file_system", "none"]
        },
        "failure_mode": {
          "type": "string",
          "enum": ["graceful_degradation", "fail_closed", "queue_retry", "best_effort"]
        },
        "auth_method": {
          "type": "string",
          "enum": ["jwt", "session", "oauth2", "api_key", "none"]
        }
      }
    }
  }
}
